Model_AIIC_refactor/experiments_refactored/20260422_050408_full_mlp_capacity_search_v2/latency/20260424_113333_all-runs_3runs_6b4a9c06ce_cpu/latency_results.csv

benchmark_id,timestamp,device,runtime_backend,run_name,run_dir,experiment_name,model_label,training_label,model_type,seq_len,num_ports,execution_mode,requested_precision_profile,effective_execution_dtype,batch_size,num_threads,status,skip_reason,graph_prep_time_ms,warmup_iters,measure_iters,mean_latency_ms,std_latency_ms,min_latency_ms,p50_latency_ms,p90_latency_ms,p95_latency_ms,p99_latency_ms,max_latency_ms,throughput_samples_per_sec,samples_per_ms,p50_latency_us,latency_per_sample_us,throughput_per_thread,trainable_parameters,macs_per_sample,flops_per_sample_estimate,thread_group,threads_per_physical_core_ratio,threads_per_logical_cpu_ratio,cpu_model_name,cpu_capability,cpu_flag_summary,mkldnn_available,mkldnn_enabled,onednn_version,onnxruntime_version,onnxruntime_providers,openvino_version,openvino_device,logical_cpu_count,physical_cpu_count,hostname,python_version,pytorch_version
20260424_113333,2026-04-24T11:34:11.223822,cpu,pytorch,full_mlp_capacity_search_hd32_depth2,/home/liangyi/SRS_AI/Model_AIIC_refactor/experiments_refactored/20260422_050408_full_mlp_capacity_search_v2/full_mlp_capacity_search_hd32_depth2,full_mlp_capacity_search_v2,full_mlp_capacity_search_hd32_depth2,supervised_nmse_plateau,full_mlp,12,6,jit,fp32,float32,1,1,ok,,53.798064,3,5,0.0429526,0.003433057331301065,0.038982,0.041081,0.0471086,0.0471898,0.04725476,0.047271,23281.47772195397,23.28147772195397,41.080999999999996,41.080999999999996,23281.47772195397,3600,3456,7128,single-thread,0.015625,0.0078125,Intel(R) Xeon(R) Platinum 8358 CPU $@ $@,AVX512,"avx2,avx512f,avx512bw,avx512vl,avx512_vnni,fma",True,True,,,,,,128,64,nex-flexran-gpu-01,3.11.9,2.1.2+cu121
20260424_113333,2026-04-24T11:34:11.223822,cpu,pytorch,full_mlp_capacity_search_hd32_depth2,/home/liangyi/SRS_AI/Model_AIIC_refactor/experiments_refactored/20260422_050408_full_mlp_capacity_search_v2/full_mlp_capacity_search_hd32_depth2,full_mlp_capacity_search_v2,full_mlp_capacity_search_hd32_depth2,supervised_nmse_plateau,full_mlp,12,6,jit,fp32,float32,128,1,ok,,55.619668,3,5,0.0582834,0.0030492303684700518,0.054963,0.057437,0.0619188,0.0620294,0.06211788,0.06214,2196165.6320667635,2196.1656320667635,57.437000000000005,0.44872656250000004,2196165.6320667635,3600,3456,7128,single-thread,0.015625,0.0078125,Intel(R) Xeon(R) Platinum 8358 CPU $@ $@,AVX512,"avx2,avx512f,avx512bw,avx512vl,avx512_vnni,fma",True,True,,,,,,128,64,nex-flexran-gpu-01,3.11.9,2.1.2+cu121
20260424_113333,2026-04-24T11:34:11.223822,cpu,onnxruntime,full_mlp_capacity_search_hd32_depth2,/home/liangyi/SRS_AI/Model_AIIC_refactor/experiments_refactored/20260422_050408_full_mlp_capacity_search_v2/full_mlp_capacity_search_hd32_depth2,full_mlp_capacity_search_v2,full_mlp_capacity_search_hd32_depth2,supervised_nmse_plateau,full_mlp,12,6,onnxruntime,fp32,float32,1,1,ok,,2.949399,3,5,0.0144178,0.001381951576575677,0.012922,0.014089,0.0160862,0.0162416,0.01636592,0.016397,69358.709373136,69.358709373136,14.089,14.089,69358.709373136,3600,3456,7128,single-thread,0.015625,0.0078125,Intel(R) Xeon(R) Platinum 8358 CPU $@ $@,AVX512,"avx2,avx512f,avx512bw,avx512vl,avx512_vnni,fma",True,True,,1.23.2,CPUExecutionProvider,,,128,64,nex-flexran-gpu-01,3.11.9,2.1.2+cu121
20260424_113333,2026-04-24T11:34:11.223822,cpu,onnxruntime,full_mlp_capacity_search_hd32_depth2,/home/liangyi/SRS_AI/Model_AIIC_refactor/experiments_refactored/20260422_050408_full_mlp_capacity_search_v2/full_mlp_capacity_search_hd32_depth2,full_mlp_capacity_search_v2,full_mlp_capacity_search_hd32_depth2,supervised_nmse_plateau,full_mlp,12,6,onnxruntime,fp32,float32,128,1,ok,,3.074429,3,5,0.033291600000000005,0.001368771799826399,0.03194,0.032706,0.034989,0.035254,0.035466000000000004,0.035519,3844813.7067608642,3844.813706760864,32.705999999999996,0.25551562499999997,3844813.7067608642,3600,3456,7128,single-thread,0.015625,0.0078125,Intel(R) Xeon(R) Platinum 8358 CPU $@ $@,AVX512,"avx2,avx512f,avx512bw,avx512vl,avx512_vnni,fma",True,True,,1.23.2,CPUExecutionProvider,,,128,64,nex-flexran-gpu-01,3.11.9,2.1.2+cu121
20260424_113333,2026-04-24T11:34:11.223822,cpu,openvino,full_mlp_capacity_search_hd32_depth2,/home/liangyi/SRS_AI/Model_AIIC_refactor/experiments_refactored/20260422_050408_full_mlp_capacity_search_v2/full_mlp_capacity_search_hd32_depth2,full_mlp_capacity_search_v2,full_mlp_capacity_search_hd32_depth2,supervised_nmse_plateau,full_mlp,12,6,openvino,fp32,float32,1,1,ok,,109.552383,3,5,0.1547602,0.007302298032811308,0.144325,0.154059,0.16294999999999998,0.164688,0.1660784,0.166426,6461.609638653867,6.461609638653867,154.059,154.059,6461.609638653867,3600,3456,7128,single-thread,0.015625,0.0078125,Intel(R) Xeon(R) Platinum 8358 CPU $@ $@,AVX512,"avx2,avx512f,avx512bw,avx512vl,avx512_vnni,fma",True,True,,,,2026.1.0,CPU,128,64,nex-flexran-gpu-01,3.11.9,2.1.2+cu121
20260424_113333,2026-04-24T11:34:11.223822,cpu,openvino,full_mlp_capacity_search_hd32_depth2,/home/liangyi/SRS_AI/Model_AIIC_refactor/experiments_refactored/20260422_050408_full_mlp_capacity_search_v2/full_mlp_capacity_search_hd32_depth2,full_mlp_capacity_search_v2,full_mlp_capacity_search_hd32_depth2,supervised_nmse_plateau,full_mlp,12,6,openvino,fp32,float32,128,1,ok,,128.208008,3,5,0.1960576,0.014998399122573046,0.181866,0.18837,0.2147758,0.2178454,0.22030108,0.220915,652869.3608408957,652.8693608408956,188.37,1.471640625,652869.3608408957,3600,3456,7128,single-thread,0.015625,0.0078125,Intel(R) Xeon(R) Platinum 8358 CPU $@ $@,AVX512,"avx2,avx512f,avx512bw,avx512vl,avx512_vnni,fma",True,True,,,,2026.1.0,CPU,128,64,nex-flexran-gpu-01,3.11.9,2.1.2+cu121
20260424_113333,2026-04-24T11:34:11.223822,cpu,pytorch,full_mlp_capacity_search_hd256_depth4,/home/liangyi/SRS_AI/Model_AIIC_refactor/experiments_refactored/20260422_050408_full_mlp_capacity_search_v2/full_mlp_capacity_search_hd256_depth4,full_mlp_capacity_search_v2,full_mlp_capacity_search_hd256_depth4,supervised_nmse_plateau,full_mlp,12,6,jit,fp32,float32,1,1,ok,,64.186921,3,5,0.0567012,0.0036859683341016383,0.052336,0.056194,0.060996,0.061146000000000006,0.061266,0.061296,17636.311048090694,17.636311048090693,56.194,56.194,17636.311048090694,109200,108544,217816,single-thread,0.015625,0.0078125,Intel(R) Xeon(R) Platinum 8358 CPU $@ $@,AVX512,"avx2,avx512f,avx512bw,avx512vl,avx512_vnni,fma",True,True,,,,,,128,64,nex-flexran-gpu-01,3.11.9,2.1.2+cu121
20260424_113333,2026-04-24T11:34:11.223822,cpu,pytorch,full_mlp_capacity_search_hd256_depth4,/home/liangyi/SRS_AI/Model_AIIC_refactor/experiments_refactored/20260422_050408_full_mlp_capacity_search_v2/full_mlp_capacity_search_hd256_depth4,full_mlp_capacity_search_v2,full_mlp_capacity_search_hd256_depth4,supervised_nmse_plateau,full_mlp,12,6,jit,fp32,float32,128,1,ok,,66.908706,3,5,0.258185,0.007511063013981454,0.250131,0.257761,0.2665402,0.2691716,0.27127672,0.271803,495768.5380637914,495.7685380637914,257.761,2.0137578125,495768.5380637914,109200,108544,217816,single-thread,0.015625,0.0078125,Intel(R) Xeon(R) Platinum 8358 CPU $@ $@,AVX512,"avx2,avx512f,avx512bw,avx512vl,avx512_vnni,fma",True,True,,,,,,128,64,nex-flexran-gpu-01,3.11.9,2.1.2+cu121
20260424_113333,2026-04-24T11:34:11.223822,cpu,onnxruntime,full_mlp_capacity_search_hd256_depth4,/home/liangyi/SRS_AI/Model_AIIC_refactor/experiments_refactored/20260422_050408_full_mlp_capacity_search_v2/full_mlp_capacity_search_hd256_depth4,full_mlp_capacity_search_v2,full_mlp_capacity_search_hd256_depth4,supervised_nmse_plateau,full_mlp,12,6,onnxruntime,fp32,float32,1,1,ok,,3.913117,3,5,0.0204302,0.0013337908981545794,0.019033,0.020211,0.0220294,0.0222552,0.022435840000000002,0.022481,48947.1468708089,48.9471468708089,20.211,20.211,48947.1468708089,109200,108544,217816,single-thread,0.015625,0.0078125,Intel(R) Xeon(R) Platinum 8358 CPU $@ $@,AVX512,"avx2,avx512f,avx512bw,avx512vl,avx512_vnni,fma",True,True,,1.23.2,CPUExecutionProvider,,,128,64,nex-flexran-gpu-01,3.11.9,2.1.2+cu121
20260424_113333,2026-04-24T11:34:11.223822,cpu,onnxruntime,full_mlp_capacity_search_hd256_depth4,/home/liangyi/SRS_AI/Model_AIIC_refactor/experiments_refactored/20260422_050408_full_mlp_capacity_search_v2/full_mlp_capacity_search_hd256_depth4,full_mlp_capacity_search_v2,full_mlp_capacity_search_hd256_depth4,supervised_nmse_plateau,full_mlp,12,6,onnxruntime,fp32,float32,128,1,ok,,3.936684,3,5,0.2088028,0.004689858778257613,0.205292,0.206887,0.2138798,0.2159674,0.21763748,0.218055,613018.5993674414,613.0185993674414,206.887,1.6163046875,613018.5993674414,109200,108544,217816,single-thread,0.015625,0.0078125,Intel(R) Xeon(R) Platinum 8358 CPU $@ $@,AVX512,"avx2,avx512f,avx512bw,avx512vl,avx512_vnni,fma",True,True,,1.23.2,CPUExecutionProvider,,,128,64,nex-flexran-gpu-01,3.11.9,2.1.2+cu121
20260424_113333,2026-04-24T11:34:11.223822,cpu,openvino,full_mlp_capacity_search_hd256_depth4,/home/liangyi/SRS_AI/Model_AIIC_refactor/experiments_refactored/20260422_050408_full_mlp_capacity_search_v2/full_mlp_capacity_search_hd256_depth4,full_mlp_capacity_search_v2,full_mlp_capacity_search_hd256_depth4,supervised_nmse_plateau,full_mlp,12,6,openvino,fp32,float32,1,1,ok,,143.023974,3,5,0.1186036,0.0075307070212563745,0.111106,0.11692,0.1273782,0.1298416,0.13181232,0.132305,8431.447274787612,8.431447274787612,116.92,116.92,8431.447274787612,109200,108544,217816,single-thread,0.015625,0.0078125,Intel(R) Xeon(R) Platinum 8358 CPU $@ $@,AVX512,"avx2,avx512f,avx512bw,avx512vl,avx512_vnni,fma",True,True,,,,2026.1.0,CPU,128,64,nex-flexran-gpu-01,3.11.9,2.1.2+cu121
20260424_113333,2026-04-24T11:34:11.223822,cpu,openvino,full_mlp_capacity_search_hd256_depth4,/home/liangyi/SRS_AI/Model_AIIC_refactor/experiments_refactored/20260422_050408_full_mlp_capacity_search_v2/full_mlp_capacity_search_hd256_depth4,full_mlp_capacity_search_v2,full_mlp_capacity_search_hd256_depth4,supervised_nmse_plateau,full_mlp,12,6,openvino,fp32,float32,128,1,ok,,146.315657,3,5,0.1558544,0.008737442293943916,0.14617,0.150782,0.1665446,0.1668878,0.16716235999999998,0.167231,821279.3479041978,821.2793479041977,150.782,1.177984375,821279.3479041978,109200,108544,217816,single-thread,0.015625,0.0078125,Intel(R) Xeon(R) Platinum 8358 CPU $@ $@,AVX512,"avx2,avx512f,avx512bw,avx512vl,avx512_vnni,fma",True,True,,,,2026.1.0,CPU,128,64,nex-flexran-gpu-01,3.11.9,2.1.2+cu121
20260424_113333,2026-04-24T11:34:11.223822,cpu,pytorch,full_mlp_capacity_search_hd512_depth5,/home/liangyi/SRS_AI/Model_AIIC_refactor/experiments_refactored/20260422_050408_full_mlp_capacity_search_v2/full_mlp_capacity_search_hd512_depth5,full_mlp_capacity_search_v2,full_mlp_capacity_search_hd512_depth5,supervised_nmse_plateau,full_mlp,12,6,jit,fp32,float32,1,1,ok,,68.979143,3,5,0.1667556,0.010966924338208955,0.151126,0.169712,0.17836359999999998,0.1795028,0.18041416,0.180642,5996.800107462658,5.996800107462658,169.712,169.712,5996.800107462658,611984,610304,1222360,single-thread,0.015625,0.0078125,Intel(R) Xeon(R) Platinum 8358 CPU $@ $@,AVX512,"avx2,avx512f,avx512bw,avx512vl,avx512_vnni,fma",True,True,,,,,,128,64,nex-flexran-gpu-01,3.11.9,2.1.2+cu121
20260424_113333,2026-04-24T11:34:11.223822,cpu,pytorch,full_mlp_capacity_search_hd512_depth5,/home/liangyi/SRS_AI/Model_AIIC_refactor/experiments_refactored/20260422_050408_full_mlp_capacity_search_v2/full_mlp_capacity_search_hd512_depth5,full_mlp_capacity_search_v2,full_mlp_capacity_search_hd512_depth5,supervised_nmse_plateau,full_mlp,12,6,jit,fp32,float32,128,1,ok,,76.254278,3,5,0.9898275999999999,0.0035074973186019634,0.984409,0.990239,0.9934326,0.9943508,0.9950853599999999,0.995269,129315.44846799584,129.31544846799585,990.239,7.7362421875,129315.44846799584,611984,610304,1222360,single-thread,0.015625,0.0078125,Intel(R) Xeon(R) Platinum 8358 CPU $@ $@,AVX512,"avx2,avx512f,avx512bw,avx512vl,avx512_vnni,fma",True,True,,,,,,128,64,nex-flexran-gpu-01,3.11.9,2.1.2+cu121
20260424_113333,2026-04-24T11:34:11.223822,cpu,onnxruntime,full_mlp_capacity_search_hd512_depth5,/home/liangyi/SRS_AI/Model_AIIC_refactor/experiments_refactored/20260422_050408_full_mlp_capacity_search_v2/full_mlp_capacity_search_hd512_depth5,full_mlp_capacity_search_v2,full_mlp_capacity_search_hd512_depth5,supervised_nmse_plateau,full_mlp,12,6,onnxruntime,fp32,float32,1,1,ok,,7.47384,3,5,0.1048664,0.001958733938032421,0.102779,0.104659,0.1071736,0.1076468,0.10802536,0.10812,9535.942875887797,9.535942875887796,104.659,104.659,9535.942875887797,611984,610304,1222360,single-thread,0.015625,0.0078125,Intel(R) Xeon(R) Platinum 8358 CPU $@ $@,AVX512,"avx2,avx512f,avx512bw,avx512vl,avx512_vnni,fma",True,True,,1.23.2,CPUExecutionProvider,,,128,64,nex-flexran-gpu-01,3.11.9,2.1.2+cu121
20260424_113333,2026-04-24T11:34:11.223822,cpu,onnxruntime,full_mlp_capacity_search_hd512_depth5,/home/liangyi/SRS_AI/Model_AIIC_refactor/experiments_refactored/20260422_050408_full_mlp_capacity_search_v2/full_mlp_capacity_search_hd512_depth5,full_mlp_capacity_search_v2,full_mlp_capacity_search_hd512_depth5,supervised_nmse_plateau,full_mlp,12,6,onnxruntime,fp32,float32,128,1,ok,,7.770355,3,5,0.9814006,0.004066133524615236,0.977018,0.981095,0.9860846,0.9872778,0.98823236,0.988471,130425.8424133835,130.42584241338352,981.095,7.6648046875,130425.8424133835,611984,610304,1222360,single-thread,0.015625,0.0078125,Intel(R) Xeon(R) Platinum 8358 CPU $@ $@,AVX512,"avx2,avx512f,avx512bw,avx512vl,avx512_vnni,fma",True,True,,1.23.2,CPUExecutionProvider,,,128,64,nex-flexran-gpu-01,3.11.9,2.1.2+cu121
20260424_113333,2026-04-24T11:34:11.223822,cpu,openvino,full_mlp_capacity_search_hd512_depth5,/home/liangyi/SRS_AI/Model_AIIC_refactor/experiments_refactored/20260422_050408_full_mlp_capacity_search_v2/full_mlp_capacity_search_hd512_depth5,full_mlp_capacity_search_v2,full_mlp_capacity_search_hd512_depth5,supervised_nmse_plateau,full_mlp,12,6,openvino,fp32,float32,1,1,ok,,138.389061,3,5,0.13181120000000002,0.006767616844946235,0.122091,0.131834,0.1390394,0.1410182,0.14260124000000002,0.142997,7586.608725206961,7.586608725206961,131.834,131.834,7586.608725206961,611984,610304,1222360,single-thread,0.015625,0.0078125,Intel(R) Xeon(R) Platinum 8358 CPU $@ $@,AVX512,"avx2,avx512f,avx512bw,avx512vl,avx512_vnni,fma",True,True,,,,2026.1.0,CPU,128,64,nex-flexran-gpu-01,3.11.9,2.1.2+cu121
20260424_113333,2026-04-24T11:34:11.223822,cpu,openvino,full_mlp_capacity_search_hd512_depth5,/home/liangyi/SRS_AI/Model_AIIC_refactor/experiments_refactored/20260422_050408_full_mlp_capacity_search_v2/full_mlp_capacity_search_hd512_depth5,full_mlp_capacity_search_v2,full_mlp_capacity_search_hd512_depth5,supervised_nmse_plateau,full_mlp,12,6,openvino,fp32,float32,128,1,ok,,151.22627,3,5,0.2877312,0.009739271459405991,0.271575,0.290544,0.2973442,0.2979836,0.29849512,0.298623,444859.6467814404,444.8596467814404,290.54400000000004,2.2698750000000003,444859.6467814404,611984,610304,1222360,single-thread,0.015625,0.0078125,Intel(R) Xeon(R) Platinum 8358 CPU $@ $@,AVX512,"avx2,avx512f,avx512bw,avx512vl,avx512_vnni,fma",True,True,,,,2026.1.0,CPU,128,64,nex-flexran-gpu-01,3.11.9,2.1.2+cu121

Model_AIIC_refactor/experiments_refactored/20260422_050408_full_mlp_capacity_search_v2/latency/20260424_113333_all-runs_3runs_6b4a9c06ce_cpu/LATENCY_REPORT.md

### full_mlp_capacity_search_hd32_depth2::pytorch::jit

- Runtime backend: `pytorch`
- Execution mode: `jit`
- Best throughput config: threads=`1`, batch=`128`, precision=`fp32`, throughput=`2196165.632` samples/s, p50=`0.057` ms
- Lowest batch-1 p50 latency: threads=`1`, precision=`fp32`, p50=`0.041` ms, throughput=`23281.478` samples/s

### full_mlp_capacity_search_hd32_depth2::onnxruntime::onnxruntime

- Runtime backend: `onnxruntime`
- Execution mode: `onnxruntime`
- Best throughput config: threads=`1`, batch=`128`, precision=`fp32`, throughput=`3844813.707` samples/s, p50=`0.033` ms
- Lowest batch-1 p50 latency: threads=`1`, precision=`fp32`, p50=`0.014` ms, throughput=`69358.709` samples/s

### full_mlp_capacity_search_hd32_depth2::openvino::openvino

- Runtime backend: `openvino`
- Execution mode: `openvino`
- Best throughput config: threads=`1`, batch=`128`, precision=`fp32`, throughput=`652869.361` samples/s, p50=`0.188` ms
- Lowest batch-1 p50 latency: threads=`1`, precision=`fp32`, p50=`0.154` ms, throughput=`6461.610` samples/s

### full_mlp_capacity_search_hd256_depth4::pytorch::jit

- Runtime backend: `pytorch`
- Execution mode: `jit`
- Best throughput config: threads=`1`, batch=`128`, precision=`fp32`, throughput=`495768.538` samples/s, p50=`0.258` ms
- Lowest batch-1 p50 latency: threads=`1`, precision=`fp32`, p50=`0.056` ms, throughput=`17636.311` samples/s

### full_mlp_capacity_search_hd256_depth4::onnxruntime::onnxruntime

- Runtime backend: `onnxruntime`
- Execution mode: `onnxruntime`
- Best throughput config: threads=`1`, batch=`128`, precision=`fp32`, throughput=`613018.599` samples/s, p50=`0.207` ms
- Lowest batch-1 p50 latency: threads=`1`, precision=`fp32`, p50=`0.020` ms, throughput=`48947.147` samples/s

### full_mlp_capacity_search_hd256_depth4::openvino::openvino

- Runtime backend: `openvino`
- Execution mode: `openvino`
- Best throughput config: threads=`1`, batch=`128`, precision=`fp32`, throughput=`821279.348` samples/s, p50=`0.151` ms
- Lowest batch-1 p50 latency: threads=`1`, precision=`fp32`, p50=`0.117` ms, throughput=`8431.447` samples/s

### full_mlp_capacity_search_hd512_depth5::pytorch::jit

- Runtime backend: `pytorch`
- Execution mode: `jit`
- Best throughput config: threads=`1`, batch=`128`, precision=`fp32`, throughput=`129315.448` samples/s, p50=`0.990` ms
- Lowest batch-1 p50 latency: threads=`1`, precision=`fp32`, p50=`0.170` ms, throughput=`5996.800` samples/s

### full_mlp_capacity_search_hd512_depth5::onnxruntime::onnxruntime

- Runtime backend: `onnxruntime`
- Execution mode: `onnxruntime`
- Best throughput config: threads=`1`, batch=`128`, precision=`fp32`, throughput=`130425.842` samples/s, p50=`0.981` ms
- Lowest batch-1 p50 latency: threads=`1`, precision=`fp32`, p50=`0.105` ms, throughput=`9535.943` samples/s

### full_mlp_capacity_search_hd512_depth5::openvino::openvino

- Runtime backend: `openvino`
- Execution mode: `openvino`
- Best throughput config: threads=`1`, batch=`128`, precision=`fp32`, throughput=`444859.647` samples/s, p50=`0.291` ms
- Lowest batch-1 p50 latency: threads=`1`, precision=`fp32`, p50=`0.132` ms, throughput=`7586.609` samples/s