Model_AIIC_refactor/experiments_refactored/20260422_050408_full_mlp_capacity_search_v2/full_mlp_capacity_search_hd512_depth5/latency/20260424_113333_cpu/latency_results.csv

benchmark_id,timestamp,device,runtime_backend,run_name,run_dir,experiment_name,model_label,training_label,model_type,seq_len,num_ports,execution_mode,requested_precision_profile,effective_execution_dtype,batch_size,num_threads,status,skip_reason,graph_prep_time_ms,warmup_iters,measure_iters,mean_latency_ms,std_latency_ms,min_latency_ms,p50_latency_ms,p90_latency_ms,p95_latency_ms,p99_latency_ms,max_latency_ms,throughput_samples_per_sec,samples_per_ms,p50_latency_us,latency_per_sample_us,throughput_per_thread,trainable_parameters,macs_per_sample,flops_per_sample_estimate,thread_group,threads_per_physical_core_ratio,threads_per_logical_cpu_ratio,cpu_model_name,cpu_capability,cpu_flag_summary,mkldnn_available,mkldnn_enabled,onednn_version,onnxruntime_version,onnxruntime_providers,openvino_version,openvino_device,logical_cpu_count,physical_cpu_count,hostname,python_version,pytorch_version
20260424_113333,2026-04-24T11:34:10.934835,cpu,pytorch,full_mlp_capacity_search_hd512_depth5,/home/liangyi/SRS_AI/Model_AIIC_refactor/experiments_refactored/20260422_050408_full_mlp_capacity_search_v2/full_mlp_capacity_search_hd512_depth5,full_mlp_capacity_search_v2,full_mlp_capacity_search_hd512_depth5,supervised_nmse_plateau,full_mlp,12,6,jit,fp32,float32,1,1,ok,,68.979143,3,5,0.1667556,0.010966924338208955,0.151126,0.169712,0.17836359999999998,0.1795028,0.18041416,0.180642,5996.800107462658,5.996800107462658,169.712,169.712,5996.800107462658,611984,610304,1222360,single-thread,0.015625,0.0078125,Intel(R) Xeon(R) Platinum 8358 CPU $@ $@,AVX512,"avx2,avx512f,avx512bw,avx512vl,avx512_vnni,fma",True,True,,,,,,128,64,nex-flexran-gpu-01,3.11.9,2.1.2+cu121
20260424_113333,2026-04-24T11:34:10.934835,cpu,pytorch,full_mlp_capacity_search_hd512_depth5,/home/liangyi/SRS_AI/Model_AIIC_refactor/experiments_refactored/20260422_050408_full_mlp_capacity_search_v2/full_mlp_capacity_search_hd512_depth5,full_mlp_capacity_search_v2,full_mlp_capacity_search_hd512_depth5,supervised_nmse_plateau,full_mlp,12,6,jit,fp32,float32,128,1,ok,,76.254278,3,5,0.9898275999999999,0.0035074973186019634,0.984409,0.990239,0.9934326,0.9943508,0.9950853599999999,0.995269,129315.44846799584,129.31544846799585,990.239,7.7362421875,129315.44846799584,611984,610304,1222360,single-thread,0.015625,0.0078125,Intel(R) Xeon(R) Platinum 8358 CPU $@ $@,AVX512,"avx2,avx512f,avx512bw,avx512vl,avx512_vnni,fma",True,True,,,,,,128,64,nex-flexran-gpu-01,3.11.9,2.1.2+cu121
20260424_113333,2026-04-24T11:34:10.934835,cpu,onnxruntime,full_mlp_capacity_search_hd512_depth5,/home/liangyi/SRS_AI/Model_AIIC_refactor/experiments_refactored/20260422_050408_full_mlp_capacity_search_v2/full_mlp_capacity_search_hd512_depth5,full_mlp_capacity_search_v2,full_mlp_capacity_search_hd512_depth5,supervised_nmse_plateau,full_mlp,12,6,onnxruntime,fp32,float32,1,1,ok,,7.47384,3,5,0.1048664,0.001958733938032421,0.102779,0.104659,0.1071736,0.1076468,0.10802536,0.10812,9535.942875887797,9.535942875887796,104.659,104.659,9535.942875887797,611984,610304,1222360,single-thread,0.015625,0.0078125,Intel(R) Xeon(R) Platinum 8358 CPU $@ $@,AVX512,"avx2,avx512f,avx512bw,avx512vl,avx512_vnni,fma",True,True,,1.23.2,CPUExecutionProvider,,,128,64,nex-flexran-gpu-01,3.11.9,2.1.2+cu121
20260424_113333,2026-04-24T11:34:10.934835,cpu,onnxruntime,full_mlp_capacity_search_hd512_depth5,/home/liangyi/SRS_AI/Model_AIIC_refactor/experiments_refactored/20260422_050408_full_mlp_capacity_search_v2/full_mlp_capacity_search_hd512_depth5,full_mlp_capacity_search_v2,full_mlp_capacity_search_hd512_depth5,supervised_nmse_plateau,full_mlp,12,6,onnxruntime,fp32,float32,128,1,ok,,7.770355,3,5,0.9814006,0.004066133524615236,0.977018,0.981095,0.9860846,0.9872778,0.98823236,0.988471,130425.8424133835,130.42584241338352,981.095,7.6648046875,130425.8424133835,611984,610304,1222360,single-thread,0.015625,0.0078125,Intel(R) Xeon(R) Platinum 8358 CPU $@ $@,AVX512,"avx2,avx512f,avx512bw,avx512vl,avx512_vnni,fma",True,True,,1.23.2,CPUExecutionProvider,,,128,64,nex-flexran-gpu-01,3.11.9,2.1.2+cu121
20260424_113333,2026-04-24T11:34:10.934835,cpu,openvino,full_mlp_capacity_search_hd512_depth5,/home/liangyi/SRS_AI/Model_AIIC_refactor/experiments_refactored/20260422_050408_full_mlp_capacity_search_v2/full_mlp_capacity_search_hd512_depth5,full_mlp_capacity_search_v2,full_mlp_capacity_search_hd512_depth5,supervised_nmse_plateau,full_mlp,12,6,openvino,fp32,float32,1,1,ok,,138.389061,3,5,0.13181120000000002,0.006767616844946235,0.122091,0.131834,0.1390394,0.1410182,0.14260124000000002,0.142997,7586.608725206961,7.586608725206961,131.834,131.834,7586.608725206961,611984,610304,1222360,single-thread,0.015625,0.0078125,Intel(R) Xeon(R) Platinum 8358 CPU $@ $@,AVX512,"avx2,avx512f,avx512bw,avx512vl,avx512_vnni,fma",True,True,,,,2026.1.0,CPU,128,64,nex-flexran-gpu-01,3.11.9,2.1.2+cu121
20260424_113333,2026-04-24T11:34:10.934835,cpu,openvino,full_mlp_capacity_search_hd512_depth5,/home/liangyi/SRS_AI/Model_AIIC_refactor/experiments_refactored/20260422_050408_full_mlp_capacity_search_v2/full_mlp_capacity_search_hd512_depth5,full_mlp_capacity_search_v2,full_mlp_capacity_search_hd512_depth5,supervised_nmse_plateau,full_mlp,12,6,openvino,fp32,float32,128,1,ok,,151.22627,3,5,0.2877312,0.009739271459405991,0.271575,0.290544,0.2973442,0.2979836,0.29849512,0.298623,444859.6467814404,444.8596467814404,290.54400000000004,2.2698750000000003,444859.6467814404,611984,610304,1222360,single-thread,0.015625,0.0078125,Intel(R) Xeon(R) Platinum 8358 CPU $@ $@,AVX512,"avx2,avx512f,avx512bw,avx512vl,avx512_vnni,fma",True,True,,,,2026.1.0,CPU,128,64,nex-flexran-gpu-01,3.11.9,2.1.2+cu121

Model_AIIC_refactor/experiments_refactored/20260422_050408_full_mlp_capacity_search_v2/latency/20260424_113333_all-runs_3runs_6b4a9c06ce_cpu/LATENCY_REPORT.md

### full_mlp_capacity_search_hd256_depth4::openvino::openvino

- Runtime backend: `openvino`
- Execution mode: `openvino`
- Best throughput config: threads=`1`, batch=`128`, precision=`fp32`, throughput=`821279.348` samples/s, p50=`0.151` ms
- Lowest batch-1 p50 latency: threads=`1`, precision=`fp32`, p50=`0.117` ms, throughput=`8431.447` samples/s

### full_mlp_capacity_search_hd512_depth5::pytorch::jit

- Runtime backend: `pytorch`
- Execution mode: `jit`
- Best throughput config: threads=`1`, batch=`128`, precision=`fp32`, throughput=`129315.448` samples/s, p50=`0.990` ms
- Lowest batch-1 p50 latency: threads=`1`, precision=`fp32`, p50=`0.170` ms, throughput=`5996.800` samples/s

### full_mlp_capacity_search_hd512_depth5::onnxruntime::onnxruntime

- Runtime backend: `onnxruntime`
- Execution mode: `onnxruntime`
- Best throughput config: threads=`1`, batch=`128`, precision=`fp32`, throughput=`130425.842` samples/s, p50=`0.981` ms
- Lowest batch-1 p50 latency: threads=`1`, precision=`fp32`, p50=`0.105` ms, throughput=`9535.943` samples/s

### full_mlp_capacity_search_hd512_depth5::openvino::openvino

- Runtime backend: `openvino`
- Execution mode: `openvino`
- Best throughput config: threads=`1`, batch=`128`, precision=`fp32`, throughput=`444859.647` samples/s, p50=`0.291` ms
- Lowest batch-1 p50 latency: threads=`1`, precision=`fp32`, p50=`0.132` ms, throughput=`7586.609` samples/s